{
  "schemaVersion": 1,
  "repository": "OWNER/REPOSITORY",
  "canonicalBranch": "feature/FEATURE-ID",
  "workflowPhase": "BLOCKED",
  "packageStatus": "PLANNED",
  "activePackage": "AP-001",
  "nextPackage": null,
  "canonicalParent": null,
  "candidateBranch": null,
  "pullRequest": null,
  "selectedCandidate": null,
  "candidateSelection": null,
  "lastRun": null,
  "reviewedCommit": null,
  "reviewReport": null,
  "openFindingIds": [],
  "humanApproval": null,
  "writeOwner": null,
  "workAuthorization": null,
  "blockingReason": "Planungsbaseline noch nicht genehmigt",
  "nextAction": "Zuerst Planung und unabhängige Planprüfung abschließen; nach menschlichem Planfreeze neuen Status ermitteln.",
  "planBaseline": null,
  "relatedFix": null,
  "recovery": null
}
